{
  "schema_version": "1.0",
  "id": "d34dd386c9eea38857380257",
  "split": "train",
  "offset_unit": "unicode_codepoint",
  "end_exclusive": true,
  "label_definition": {
    "human": "retained verified non-AI source",
    "ai": "LLM-emitted replacement prose"
  },
  "text": "Happy for all her maternal feelings was the day on which Mrs. Bennet got\nrid of her two most deserving daughters. With what delighted pride she\nafterwards visited Mrs. Bingley, and talked of Mrs. Darcy, may be\nguessed. I wish I could say, for the sake of her family, that the\naccomplishment of her earnest desire in the establishment of so many of\nher children produced so happy an effect as to make her a sensible,\namiable, well-informed woman for the rest of her life; though, perhaps,\nit was lucky for her husband, who might not have relished domestic\nfelicity in so unusual a form, that she still was occasionally nervous\nand invariably silly.\n\nMr. Bennet missed his second daughter exceedingly; his affection for her\ndrew him oftener from home than anything else could do. He delighted in\ngoing to Pemberley, especially when he was least expected.\n\nAfter a year at Netherfield, Bingley at last purchased an estate in the neighbouring county. The news was received with satisfaction at Longbourn, for the new house stood within thirty miles of Jane and Elizabeth. Though the distance could not make their meetings as frequent as they wished, it was short enough to promise many visits, and to turn the happiness of seeing one another from a rare event into a pleasure they might reasonably anticipate.\n\nKitty, who spent much of her time with her elder sisters, grew steadier in their company. Their conversation and example did more for her than any grave lecture could have done; she began to take an interest in quieter pursuits and to rely less upon the excitement she had once sought elsewhere. Kept apart from Lydia’s influence, she gradually found that good sense could be companionable, and that affection need not be proved by following another’s lead.\n\nMary remained at home to keep her mother company. She had once regarded each new invitation as an occasion for anxiety, but the steady succession of visits brought her less trouble than she had expected. She did not become eager for every assembly, nor lose her preference for books and reflection; still, she learned to meet their callers with greater composure. Mrs. Bennet, pleased to have one daughter always near, came to depend upon Mary’s presence, while Mary herself discovered that a social call might pass without either triumph or calamity.",
  "text_sha256": "6409f4ea3a59b87e2ab03d9da1c45eedaed0eb508df0ef30bbb93968b48d5270",
  "spans": [
    {
      "start": 0,
      "end": 854,
      "label": "human",
      "source_start": 0,
      "source_end": 854,
      "author": {
        "type": "non_ai",
        "id": "jane-austen"
      },
      "replacement_id": null
    },
    {
      "start": 854,
      "end": 2317,
      "label": "ai",
      "source_start": 854,
      "source_end": 2338,
      "author": {
        "type": "ai",
        "backend": "codex",
        "kind": "codex",
        "requested_model": "gpt-6-luna",
        "reported_model": null,
        "family": "openai",
        "revision": null,
        "provider": null,
        "request_id": "01a1012e-048b-7103-9698-3377205bfbb0",
        "sampling": {},
        "generated_at": "2026-10-03T09:52:43.181643+00:00",
        "finish_reason": "completed",
        "prompt_sha256": "feb3d624087aaae7d4df49a49b557ece5e1f9dc5e5b9834e79bd7ea5ec6c2585",
        "usage": {
          "input_tokens": 13651,
          "cached_input_tokens": 11008,
          "cache_write_input_tokens": 0,
          "output_tokens": 290,
          "reasoning_output_tokens": 0
        },
        "metadata": {
          "model_identity_status": "requested_only"
        }
      },
      "replacement_id": "bae08f7203b56ce56ddcf3a1"
    }
  ],
  "source": {
    "id": "gutenberg:1342:final-chapter-first-five-paragraphs",
    "group_id": "austen:pride-and-prejudice",
    "author_id": "jane-austen",
    "reference": "https://www.gutenberg.org/files/1342/1342-0.txt",
    "text": "Happy for all her maternal feelings was the day on which Mrs. Bennet got\nrid of her two most deserving daughters. With what delighted pride she\nafterwards visited Mrs. Bingley, and talked of Mrs. Darcy, may be\nguessed. I wish I could say, for the sake of her family, that the\naccomplishment of her earnest desire in the establishment of so many of\nher children produced so happy an effect as to make her a sensible,\namiable, well-informed woman for the rest of her life; though, perhaps,\nit was lucky for her husband, who might not have relished domestic\nfelicity in so unusual a form, that she still was occasionally nervous\nand invariably silly.\n\nMr. Bennet missed his second daughter exceedingly; his affection for her\ndrew him oftener from home than anything else could do. He delighted in\ngoing to Pemberley, especially when he was least expected.\n\nMr. Bingley and Jane remained at Netherfield only a twelvemonth. So near\na vicinity to her mother and Meryton relations was not desirable even to\n_his_ easy temper, or _her_ affectionate heart. The darling wish of his\nsisters was then gratified: he bought an estate in a neighbouring county\nto Derbyshire; and Jane and Elizabeth, in addition to every other source\nof happiness, were within thirty miles of each other.\n\nKitty, to her very material advantage, spent the chief of her time with\nher two elder sisters. In society so superior to what she had generally\nknown, her improvement was great. She was not of so ungovernable a\ntemper as Lydia; and, removed from the influence of Lydia’s example, she\nbecame, by proper attention and management, less irritable, less\nignorant, and less insipid. From the further disadvantage of Lydia’s\nsociety she was of course carefully kept; and though Mrs. Wickham\nfrequently invited her to come and stay with her, with the promise of\nballs and young men, her father would never consent to her going.\n\nMary was the only daughter who remained at home; and she was necessarily\ndrawn from the pursuit of accomplishments by Mrs. Bennet’s being quite\nunable to sit alone. Mary was obliged to mix more with the world, but\nshe could still moralize over every morning visit; and as she was no\nlonger mortified by comparisons between her sisters’ beauty and her own,\nit was suspected by her father that she submitted to the change without\nmuch reluctance.",
    "human_verified": true,
    "provenance": "English prose from Jane Austen, Pride and Prejudice, originally published 1813; first five paragraphs of the final chapter preserved verbatim from the Project Gutenberg transcription.",
    "language": "en",
    "genre": "literary fiction",
    "license": "Historical original text in the public domain; Project Gutenberg distribution terms apply to the complete ebook.",
    "split": "train",
    "sha256": "e6fb8c123a99d5e2b57e74f193a88687591cdc7ecd8065a539d945976780f52d",
    "normalized_sha256": "603e229a02e6f8ad9b5aa6ff7bc4f2ab56108a86f4e4d09eab9884bbac94c188"
  },
  "replacements": [
    {
      "id": "bae08f7203b56ce56ddcf3a1",
      "source_start": 854,
      "source_end": 2338,
      "source_units": 3,
      "source_paragraphs": 3,
      "source_sentences": 9,
      "source_characters": 1484,
      "summary": "After a year at Netherfield, Bingley buys an estate in a neighboring county, placing Jane and Elizabeth within thirty miles of each other. Kitty improves while spending time with her elder sisters and is kept away from Lydia’s influence, while Mary remains at home to keep their mother company and adjusts to more social visits without apparent distress.",
      "summarization": {
        "text": "After a year at Netherfield, Bingley buys an estate in a neighboring county, placing Jane and Elizabeth within thirty miles of each other. Kitty improves while spending time with her elder sisters and is kept away from Lydia’s influence, while Mary remains at home to keep their mother company and adjusts to more social visits without apparent distress.",
        "provenance": {
          "backend": "briefs",
          "kind": "codex",
          "requested_model": "gpt-6-luna",
          "reported_model": null,
          "family": null,
          "revision": null,
          "provider": null,
          "request_id": "01a1012d-f149-7290-8061-c6c0743f7f32",
          "sampling": {},
          "generated_at": "2026-10-03T09:52:35.383786+00:00",
          "finish_reason": "completed",
          "prompt_sha256": "24ee5af3aebf8006414167b327395f15ddc2e66a3e47f10897d199568723898b",
          "usage": {
            "input_tokens": 13934,
            "cached_input_tokens": 11008,
            "cache_write_input_tokens": 0,
            "output_tokens": 71,
            "reasoning_output_tokens": 0
          },
          "metadata": {
            "model_identity_status": "requested_only"
          }
        },
        "cache_key": "ab613ee4eeb507136c93a4e1c8978e705809764eec0ece06f1ee5eb1fed41d97",